[
  {
    "IO_ID": "IO-TX-BENCHMARK-VIDEO-008-001",
    "Research_Question": "How does the observed structural shift in Official and federal and reserve transmit across institutional settlement balance sheets?",
    "Primary_Interpretation": "Primary Model (H1): Sovereign debt issuance expansion across Official and federal and reserve (Root Trigger) forces primary dealers to absorb collateral onto constrained balance sheets (Transmission Mechanism), resulting in elevated clearing spreads and persistent liquidity withdrawal (Observable Outcome). Grounded in: it's official the Federal Reserve Bank wants to reset our economy starting with the United Stat...",
    "Alternative_Interpretation": "Competing Model (H2): Counterparty reserve balances remain structurally insulated within central bank facilities, rendering the observed spread widening in Official and federal and reserve an artifact of period-end regulatory reporting frictions rather than an unbacked collateral deficit.",
    "Supporting_EO": "EO-FelixPrehn-DOLLAR-INFLATION-000000-001, EO-FelixPrehn-DOLLAR-INFLATION-000112-002, EO-FelixPrehn-BIG-ECONOMIC-GROWTH-000250-003, EO-FelixPrehn-DOLLAR-INFLATION-FED-000353-004, EO-FelixPrehn-STORE-PAY-MONEY-000488-005, EO-FelixPrehn-TREASURY-TREASURY-TREASURIES-000592-006",
    "Contradicting_EO": "NONE",
    "Contradiction_Type": "NONE",
    "Dialectical_Independence_Cosine": 0.164,
    "Confidence": 0.87,
    "Human_Review_Notes": "Authentic dialectical model evaluating MacroDebtRefinancing under domain 'macroeconomics'. Supporting EOs: 6; Contradicting EOs: 0.",
    "Future_Research_Needed": "Monitor secondary liquidity auction absorption data, dealer inventory disclosures, and interbank spread volatility.",
    "Status": "CANDIDATE",
    "Human_Approval_State": "PENDING_LEVEL_5_REVIEW",
    "Canonical_Status": "NOT_APPROVED",
    "Transaction_ID": "TX-BENCHMARK-VIDEO-008"
  },
  {
    "IO_ID": "IO-TX-BENCHMARK-VIDEO-008-002",
    "Research_Question": "Under what conditions does empirical variation in Fastest and growing and expense force collateral re-allocation versus localized absorption?",
    "Primary_Interpretation": "Primary Model (H1): Accelerating fiscal deficit projections in Fastest and growing and expense (Root Trigger) overwhelms private auction absorption capacity (Transmission Mechanism), driving systematic duration steepening and structural term premium re-pricing (Observable Outcome). Grounded in: our fastest growing expense is not social security it's not veterans benefits it's not the mili...",
    "Alternative_Interpretation": "Competing Model (H2): Sovereign issuance across Fastest and growing and expense is met with elastic foreign official and private institutional asset manager demand at critical technical yield thresholds, absorbing supply overhang without inducing broader contagion.",
    "Supporting_EO": "EO-FelixPrehn-INTEREST-DEBT-INTEREST-000719-007, EO-FelixPrehn-DEBT-000831-008, EO-FelixPrehn-DEBT-DEBT-DEBT-000962-009, EO-FelixPrehn-GROWN-BIG-BECOME-001068-010, EO-FelixPrehn-DEBT-DEBT-001200-011, EO-FelixPrehn-INFLATION-001308-012",
    "Contradicting_EO": "NONE",
    "Contradiction_Type": "NONE",
    "Dialectical_Independence_Cosine": 0.133,
    "Confidence": 0.75,
    "Human_Review_Notes": "Authentic dialectical model evaluating MacroDebtRefinancing under domain 'macroeconomics'. Supporting EOs: 6; Contradicting EOs: 0.",
    "Future_Research_Needed": "Monitor secondary liquidity auction absorption data, dealer inventory disclosures, and interbank spread volatility.",
    "Status": "CANDIDATE",
    "Human_Approval_State": "PENDING_LEVEL_5_REVIEW",
    "Canonical_Status": "NOT_APPROVED",
    "Transaction_ID": "TX-BENCHMARK-VIDEO-008"
  },
  {
    "IO_ID": "IO-TX-BENCHMARK-VIDEO-008-003",
    "Research_Question": "Does the persistence of Happening and time and thing signal a structural monetary regime transition or an ephemeral liquidity bottleneck?",
    "Primary_Interpretation": "Primary Model (H1): Depletion of institutional reverse repo buffers linked to Happening and time and thing (Root Trigger) transfers overnight collateral financing burdens to private interbank funding markets (Transmission Mechanism), elevating benchmark money-market volatility (Observable Outcome). Grounded in: happening at the same time and this is the thing that investors should be paying attention to b...",
    "Alternative_Interpretation": "Competing Model (H2): Intermarket asset rotation in Happening and time and thing reflects short-term macro portfolio duration hedging and basis arbitrage rather than a secular abandonment of established reserve currency clearing frameworks.",
    "Supporting_EO": "EO-FelixPrehn-INFLATION-001440-013, EO-FelixPrehn-DEBT-001581-014, EO-FelixPrehn-CHINA-RESPONSE-TARIFFS-001692-015, EO-FelixPrehn-DEREGULATION-MAKE-EASIER-001825-016, EO-FelixPrehn-WANT-CREATING-PROBLEMS-001931-017, EO-FelixPrehn-DEBT-INTEREST-RATES-002065-018",
    "Contradicting_EO": "NONE",
    "Contradiction_Type": "NONE",
    "Dialectical_Independence_Cosine": 0.12,
    "Confidence": 0.83,
    "Human_Review_Notes": "Authentic dialectical model evaluating MacroDebtRefinancing under domain 'macroeconomics'. Supporting EOs: 6; Contradicting EOs: 0.",
    "Future_Research_Needed": "Monitor secondary liquidity auction absorption data, dealer inventory disclosures, and interbank spread volatility.",
    "Status": "CANDIDATE",
    "Human_Approval_State": "PENDING_LEVEL_5_REVIEW",
    "Canonical_Status": "NOT_APPROVED",
    "Transaction_ID": "TX-BENCHMARK-VIDEO-008"
  },
  {
    "IO_ID": "IO-TX-BENCHMARK-VIDEO-008-004",
    "Research_Question": "What transmission velocity governs the pass-through of Able and readjust and loans into broader secondary market pricing spreads?",
    "Primary_Interpretation": "Primary Model (H1): Sovereign reserve re-allocation away from fiat foreign currency holdings into Able and readjust and loans (Root Trigger) prompts bilateral physical asset accumulation (Transmission Mechanism), decoupling monetary asset valuations from traditional real interest rates (Observable Outcome). Grounded in: then we'll be able to readjust our loans and lower interest rates and hopefully valuations will...",
    "Alternative_Interpretation": "Competing Model (H2): Central bank standing repo facility backstops provide an elastic liquidity relief valve, effectively truncating downside tail risks and anchoring overnight funding rates for Able and readjust and loans within target bands.",
    "Supporting_EO": "EO-FelixPrehn-INTEREST-RATES-INFLATION-002175-019, EO-FelixPrehn-RATES-002315-020, EO-FelixPrehn-INFLATION-DEBT-DEBT-002419-021, EO-FelixPrehn-INFLATION-DEBT-CURRENCY-002559-022, EO-FelixPrehn-INFLATION-INFLATION-INTEREST-002665-023, EO-FelixPrehn-DEBT-INFLATION-INTEREST-002798-024",
    "Contradicting_EO": "NONE",
    "Contradiction_Type": "NONE",
    "Dialectical_Independence_Cosine": 0.131,
    "Confidence": 0.69,
    "Human_Review_Notes": "Authentic dialectical model evaluating MacroDebtRefinancing under domain 'macroeconomics'. Supporting EOs: 6; Contradicting EOs: 0.",
    "Future_Research_Needed": "Monitor secondary liquidity auction absorption data, dealer inventory disclosures, and interbank spread volatility.",
    "Status": "CANDIDATE",
    "Human_Approval_State": "PENDING_LEVEL_5_REVIEW",
    "Canonical_Status": "NOT_APPROVED",
    "Transaction_ID": "TX-BENCHMARK-VIDEO-008"
  },
  {
    "IO_ID": "IO-TX-BENCHMARK-VIDEO-008-005",
    "Research_Question": "To what extent do institutional balance sheet constraints amplify the observed Recession and investing and money dynamic?",
    "Primary_Interpretation": "Primary Model (H1): Persistent cost-push pressures across Recession and investing and money (Root Trigger) constrain corporate profit margins and increase working capital financing requirements (Transmission Mechanism), accelerating corporate credit rating downgrades and private debt restructuring (Observable Outcome). Grounded in: recession investing your money is hard and on this channel I teach how you can start investing...",
    "Alternative_Interpretation": "Competing Model (H2): Private corporate cash reserves and equity issuance capacity buffer against short-term financing friction in Recession and investing and money, averting broader debt defaults despite elevated policy benchmark rates.",
    "Supporting_EO": "EO-FelixPrehn-RECESSION-INVESTING-MONEY-002911-025, EO-FelixPrehn-STOCKS-MARKET-CRASH-003074-026",
    "Contradicting_EO": "NONE",
    "Contradiction_Type": "NONE",
    "Dialectical_Independence_Cosine": 0.215,
    "Confidence": 0.81,
    "Human_Review_Notes": "Authentic dialectical model evaluating MacroDebtRefinancing under domain 'macroeconomics'. Supporting EOs: 2; Contradicting EOs: 0.",
    "Future_Research_Needed": "Monitor secondary liquidity auction absorption data, dealer inventory disclosures, and interbank spread volatility.",
    "Status": "CANDIDATE",
    "Human_Approval_State": "PENDING_LEVEL_5_REVIEW",
    "Canonical_Status": "NOT_APPROVED",
    "Transaction_ID": "TX-BENCHMARK-VIDEO-008"
  }
]